comment_id,video_id,author_name_hash,comment_text,published_at,like_count,reply_count,parent_comment_id,language_detected,source,created_at
UgzIht0joSPmy01C7bF4AaABAg,yOfvuk_ZgJY,e28937abf981a9e6,In October 2025 the 7500 dollar incentive is gone. I will keep my 4 runner which will last forever. That way when i buy a used tesla i will enjoy it as a technology car. It should last but if it ever craps on me i will always have my 4 runner.,2025-10-29T00:57:58Z,0,0,,en,youtube,2026-01-14T13:23:11.718834
UgxaqujAbLygJqz6DCd4AaABAg,yOfvuk_ZgJY,6ada6bbe1926400c,Wow!  I've never heard someone talk so much and say so little.,2025-10-27T20:00:58Z,0,0,,en,youtube,2026-01-14T13:23:11.718839
UgzPjFoWsM_i3sx445J4AaABAg,yOfvuk_ZgJY,8a1b81c3095f3983,I wouldn't buy one because long term you can't have the same EV you bought like you can an ICE car. It's not like they're gonna make the same battery for the car 30 years later where plenty of ICE cars you can get a replacement engine and transmission for most cars. Also you can't just go to a junkyard 30 years later and get a replacement battery it would probably be dead.,2025-10-22T18:48:55Z,0,1,,en,youtube,2026-01-14T13:23:11.718844
Ugy-OHx82iRPfQAZqtd4AaABAg,yOfvuk_ZgJY,37b81aa7c4832481,"Electric motors last for over 500,000 km.  Not the case for any of the much more expensive and maintenance requiring gasoline engines.",2025-10-09T20:06:16Z,0,1,,en,youtube,2026-01-14T13:23:11.718855
UgxIktwQEzWp6VlmJop4AaABAg,yOfvuk_ZgJY,37b81aa7c4832481,"Even with a road utilization tax, the gas guzzlers are going to cost you more to drive per mile than any EV.",2025-10-09T20:04:54Z,0,1,,en,youtube,2026-01-14T13:23:11.718860
UgwGW5NFLsW7V20rWP94AaABAg,yOfvuk_ZgJY,37b81aa7c4832481,It is literally insane to buy a new or used gas guzzler.  The performance is worse and the cost of ownership is much higher than any EV.  Teslas are the best EVs.,2025-10-09T20:03:39Z,0,1,,en,youtube,2026-01-14T13:23:11.718865
UgwQZJNv-yJ_Er593Kd4AaABAg,yOfvuk_ZgJY,37b81aa7c4832481,Bullshit.  My 6 year old Tesla Model 3 is estimated at $25k by GROK.  Battery still healthy.,2025-10-09T20:01:34Z,0,1,,en,youtube,2026-01-14T13:23:11.718871
UgxUb_E83H1Lan1e0YB4AaABAg,yOfvuk_ZgJY,5eb2ee5a3e7eca5a,"❤❤❤❤❤ By the way, Hertz has been dumping their Tesla inventory the last couple of years. They have very good data on the cost of running these cars and they are not as great as they were claimed to be concerning battery degradation, cost of maintenance and vehicle parts & repair availability.😢",2025-10-09T15:02:19Z,1,1,,en,youtube,2026-01-14T13:23:11.718876
UgzNRDO9Yfh6w-PvN2d4AaABAg,yOfvuk_ZgJY,31563f26d2252179,"I agree, there is no power increase coming from the utilities.  Nuclear is shelved, no new plants and they don't want China with the most experience of late, because of politics.",2025-09-15T18:06:12Z,0,0,,en,youtube,2026-01-14T13:23:11.718886
UgyXHRa4nZef5hQFhFd4AaABAg,yOfvuk_ZgJY,1b1994c8767ba38c,"I'm still not seeing why a used Tesla isn't a good idea. Losing value fast is actually a good thing if you buy a used one. Buy a 2-3 year old one, drive it 5 years and trade it. Seems like a decent plan.",2025-09-02T00:14:29Z,3,1,,en,youtube,2026-01-14T13:23:11.718891
UgzVld-QTWqKQ2EKFmt4AaABAg,yOfvuk_ZgJY,669a0d53d39be438,"Nah, what you do is buy a 4 year old Tesla at 60% off drive it for a year or two, sell it and get another one that is 4 year old.",2025-08-31T17:42:20Z,0,0,,en,youtube,2026-01-14T13:23:11.718897
UgwzsqEBQ0AOBfvowjF4AaABAg,yOfvuk_ZgJY,7a9d53c098ce20df,"This dude literally said it depreciates 10k a year, says not to buy used, buy the car that lights your money on fire so some sucker will buy it off you at 20% the price you paid",2025-08-31T08:53:57Z,0,0,,en,youtube,2026-01-14T13:23:11.718902
Ugw9upRNelQUt5gnz_54AaABAg,yOfvuk_ZgJY,9558836b9ae23d55,Picked up a 2021.5 MYP for 28k… 40k miles….. Warranty till 2029. I ain’t trippin,2025-08-31T03:22:33Z,0,0,,en,youtube,2026-01-14T13:23:11.718908
UgwA28eiA-Tc2eaxGsd4AaABAg,yOfvuk_ZgJY,3f925e0935fd3a7a,Someone help me out here.. thinking About buying a used 2013 s Tesla for 14k private party. Battery already been replaced.. exterior is mint condition as this garage kept drove by an older gentleman now having back issues reason for selling.   So is 14k worth risking? I’m back  and forth,2025-08-29T18:00:12Z,1,1,,en,youtube,2026-01-14T13:23:11.718913
UgwpVEs6rR2pHZCQwgZ4AaABAg,yOfvuk_ZgJY,d334df96f4dcb544,Becareful buying a Tesla the depreciation is crazy! Elons relationship to Trump is why so many people aren’t buying them as much . People are also getting hate from other people who own them because of Elon.  This guy did to say the real truth .,2025-07-26T13:53:47Z,0,0,,en,youtube,2026-01-14T13:23:11.718918
Ugx3pqMXt7IPtj4FHg94AaABAg,yOfvuk_ZgJY,95e6645ce517cfbf,"Nah you are wrong. They are cheap because of the used supply being so high, the used Tesla consumer market hasn’t been fully established yet. It will happen but the new Tesla consumer came first and came in a big way. Until the used Tesla buyer catches up there will be this gap.",2025-07-20T22:45:54Z,0,1,,en,youtube,2026-01-14T13:23:11.718923
UgwoD_obaRUZVw30AbF4AaABAg,yOfvuk_ZgJY,1806cb7367086068,12 years? Don’t know any owners who have an 8 year old Tesla? If so what does the battery charge at 20 percent? 😂,2025-07-19T20:04:37Z,1,1,,en,youtube,2026-01-14T13:23:11.718929
UgzQZFOAcEYJ4V4CR7d4AaABAg,yOfvuk_ZgJY,ef02aa7096074c8b,"There are so any unknown pitfalls unsuspecting buyers never dreamed of .  Soon as they leave their EV range and can’t go home to charge , then reality sets in  superchargers outside your home are super expensive, and good luck if they work , if you can find one to plug into without a 1-2 wait , or you cards won’t work or the the charger is acting funky.  All this is too much bs …driving a Lexus is too easy . Whwould anybody want to drive a big golfcart",2025-07-18T12:24:17Z,1,1,,en,youtube,2026-01-14T13:23:11.718936
UgwAvq9LYV6_Ui2dkLx4AaABAg,yOfvuk_ZgJY,040442aef48359b2,This guy is an idiot.  He has 0 knowledge on EVs,2025-07-07T12:05:42Z,0,0,,en,youtube,2026-01-14T13:23:11.718944
UgyxNAmMe5PBPTpPLzB4AaABAg,yOfvuk_ZgJY,040442aef48359b2,This has to be the most bias review I've ever seen,2025-07-07T12:01:11Z,0,0,,en,youtube,2026-01-14T13:23:11.718949
Ugxh1cLdlzeV389M82l4AaABAg,yOfvuk_ZgJY,a45f549983373d9e,Wow this car is really a tool!!!!,2025-06-25T20:31:37Z,0,0,,en,youtube,2026-01-14T13:23:11.718959
UgxyD6J4wlFbAK_Uh754AaABAg,yOfvuk_ZgJY,bf7ea48d25cc2b7d,Tesla is great! Cheap and save money for me. No maintenance.,2025-06-23T11:06:48Z,0,0,,en,youtube,2026-01-14T13:23:11.718964
UgzvErrTq1fm9SXJ4O94AaABAg,yOfvuk_ZgJY,19b6c2cc893e2954,"One main problem with Tesla is the lack of consumer reviews in more then 15 states includes California , no complete data of reliability, what we know about Tesla is for influencers (YouTubers) . Only .",2025-06-20T07:06:46Z,1,1,,en,youtube,2026-01-14T13:23:11.718975
Ugw_a-GXGcQZ4Jc08ut4AaABAg,yOfvuk_ZgJY,4626ff26393230f4,Kentucky adds $250/year EV add-on.,2025-06-13T17:30:35Z,0,0,,en,youtube,2026-01-14T13:23:11.718980
UgyeR4TOgv1sYOBoJ6h4AaABAg,yOfvuk_ZgJY,1d786a188f698ce4,Is tesla made in usa?,2025-06-07T07:08:38Z,0,1,,en,youtube,2026-01-14T13:23:11.718985
UgyvFH3iniHe12QeK_N4AaABAg,yOfvuk_ZgJY,6536618869b5a46f,I have read for years about Tesla and the problematic errors with the vehicles. It seems that it is getting worse. What is going on? Another space x just fell apart a few days ago. What is going on?,2025-06-01T00:43:28Z,0,0,,en,youtube,2026-01-14T13:23:11.718990
Ugz4r7URo7pQkEesTpd4AaABAg,yOfvuk_ZgJY,46d91a7e7ca9c40a,"Haha, those worship used Tesla, you think sellers are stupid and just got rid off them?",2025-05-30T16:09:39Z,0,0,,en,youtube,2026-01-14T13:23:11.718997
UgyU8S8kNsn30zyucC14AaABAg,yOfvuk_ZgJY,fd8fb520bc203694,You better walk 😂,2025-05-23T16:13:47Z,0,1,,en,youtube,2026-01-14T13:23:11.719002
UgyrJ2yf1U16rlCltw14AaABAg,yOfvuk_ZgJY,9b4fe1e8329a6627,He sound like a Tesla hater,2025-05-14T21:43:30Z,0,0,,en,youtube,2026-01-14T13:23:11.719015
Ugzg89N6SlCe6G4BMGt4AaABAg,yOfvuk_ZgJY,e3b0c44298fc1c14,"Hyped up drama based on the obvious. Afraid of depreciation, or the end of life dead battery? Lease a new Tesla, and hand it back to dealer after two, or three years. Easy peasy. No drama necessary.",2025-05-10T12:12:35Z,0,1,,en,youtube,2026-01-14T13:23:11.719021
UgyCuJeQ0olXURRDwB94AaABAg,yOfvuk_ZgJY,f34a27946d1b59bd,"That battery talk is a myth. So many studies to prove this wrong. Also the very first electric cars in the early 1900's can still be driven. People shouldn't buy new, but the battery talk needs to go.",2025-05-09T11:57:15Z,0,0,,en,youtube,2026-01-14T13:23:11.719026
UgzLGqDyJBDbLODVoqx4AaABAg,yOfvuk_ZgJY,a517d53ccdee93fd,"What? Car are not an investment? The price is going down when a new model is out??
... Bought a used skoda superb 7 years ago for 22k€ and 20k km, I will sell it 8k€ at 140k km....
That's life",2025-04-25T06:57:39Z,0,0,,en,youtube,2026-01-14T13:23:11.719036
UgxxJJN-2L9JS7-_FJh4AaABAg,yOfvuk_ZgJY,a71930357c62bc19,"Tell me a car that gets better with age? 
A Tesla does! Over the air updates increase efficiencies and technology advancements.",2025-04-23T15:01:02Z,0,0,,en,youtube,2026-01-14T13:23:11.719041
UgyECQrsORYAWpMig294AaABAg,yOfvuk_ZgJY,f32e63e0f2e8eb73,Ev is the best,2025-04-13T12:45:08Z,0,1,,en,youtube,2026-01-14T13:23:11.719046
UgxIgngDBWwHYJT7hDx4AaABAg,yOfvuk_ZgJY,b32e1f1174054b3e,"Tesla should just stop building cars and license the EV tech to a company who knows how to build cars, like Toyota.  Elon is a carnival barker.",2025-04-07T03:36:31Z,0,0,,en,youtube,2026-01-14T13:23:11.719053
UgzG4VyQYO7n61_Nrbl4AaABAg,yOfvuk_ZgJY,23a031305f9a05dc,Tesla is not worth it 🤦🏻‍♂️,2025-04-03T14:06:43Z,2,1,,en,youtube,2026-01-14T13:23:11.719058
UgxI-DOnsfGGaMHks5t4AaABAg,yOfvuk_ZgJY,978c21d55fb060ec,Ecars are a ticking timebomb. In 10 years they are all useless. In other words they have a 10 year lifespan then splat. New batteries will cost more than the car's value at that point.,2025-04-01T14:22:51Z,0,0,,en,youtube,2026-01-14T13:23:11.719063
Ugxuqr1ON6pvoOOe46N4AaABAg,yOfvuk_ZgJY,bbc86dbb761e09f6,This is a hit piece........,2025-03-29T21:54:53Z,0,1,,en,youtube,2026-01-14T13:23:11.719069
UgwrfoV-ytKBYrRQYad4AaABAg,yOfvuk_ZgJY,48efec0107d950b1,U -BOAT on wheels,2025-03-26T21:32:30Z,1,0,,en,youtube,2026-01-14T13:23:11.719074
UgxVpLAOf2VNPnklSqB4AaABAg,yOfvuk_ZgJY,48efec0107d950b1,Swastikar!!!,2025-03-26T21:29:37Z,1,0,,en,youtube,2026-01-14T13:23:11.719079
UgyRHAnOs1CpLDcIzIV4AaABAg,yOfvuk_ZgJY,47eaa633af2727ae,"locomotive steam engines still works after 100 years, which doesn’t make them a better investment than a high speed electric train that will probably will be out dated in 30 years  . 
Tesla sells an experience with all of its tech and you pay for it. They become obsolete quickly as new experiences come to market.
People like us who enjoy the journey rather than the in car experience are better off with tried a tested gas or hybrid. 
In 10 years probably electric cars will be economical and reliable enough to be taken seriously.",2025-03-23T23:30:42Z,0,0,,en,youtube,2026-01-14T13:23:11.719084
UgyXmGu2DHUvuTIATfZ4AaABAg,yOfvuk_ZgJY,1828b48797fd12f9,"""In 2022, Elon Musk, the CEO of Tesla and SpaceX, set a world record for the largest charitable donation by a car company owner, contributing an astounding $5.7 billion…",2025-03-22T22:26:17Z,1,1,,en,youtube,2026-01-14T13:23:11.719089
Ugz5xNNKr5XyINZyEyt4AaABAg,yOfvuk_ZgJY,a6a81ff6f71ab964,My gf Nissan murano platinum 2018 blew a transmission last week and she only had 95k miles heavy on thinking about getttimg us both a Tesla,2025-03-22T21:46:54Z,3,2,,en,youtube,2026-01-14T13:23:11.719094
UgyA6bpqlGyu1IH6est4AaABAg,yOfvuk_ZgJY,0d1fd40fa8ff0216,"Why would you want to keep a car over 10 years old? I turned in a 3-year-old Volvo and lost 50%. If I had kept it for 10 years, I probably would have had to pay the dealer to take it. Show me a car that is 10 years off and you haven't had to put thousands into it. No transmission no starter no timing belt no muffler no valves no injectors no dash buttons no subscriptions for remote starting or GPS no oil changes no no no. Brakes well yes about every 8 years.",2025-03-21T13:41:25Z,2,3,,en,youtube,2026-01-14T13:23:11.719099
UgyLV9-itsbRNwouBT94AaABAg,yOfvuk_ZgJY,78181220df0165bd,This guy has no idea what he is talking about.,2025-03-19T22:44:05Z,1,0,,en,youtube,2026-01-14T13:23:11.719107
Ugzoe2I0LClBbfi_ZlN4AaABAg,yOfvuk_ZgJY,3aa01404c3029812,"its so cheap because people are afraid of the uncertain and hate the face of the company. they are also sick of evs beeing pushed at them and have issues with the range, which IS  real issue if you are not able to recharge at home and are okay with recharging on a trip every 200 miles.

i am driving one because i have the luxury of recharging at home and the time to chill every 200 miles with a good enough infrastructure in europe.
IMHO the car is currently underpriced (which it was 1 year before as well btw, then it went up by 25% then down again)

my advice is to hold on to your tesla rn or buy one if it makes sense for your circumstance
its a good car getting boring.. think of it as a prius that everyone hates",2025-03-19T12:03:26Z,0,0,,en,youtube,2026-01-14T13:23:11.719111
UgzHEhLCzaNiOnzLHL94AaABAg,yOfvuk_ZgJY,3aa01404c3029812,"running with a m3 for 3 years now and i have a few bad experiences with it:
- brake pads sometimes stick together after the car was not moved for a few days
- the car detects a passenger on the back and beeps when there is something moderatly heavy laying on it
- the car alarm went off a few times for no reason, disabled it
- the range in winter is awful and i mean AWFUL heating the car costs 3% to 5% battery
- driving at german autobahn speeds reduces the expected range to less then 200km which is i think about 125 miles
- for charging you need to adjust your route and sometimes you end up in the middle of nowhere
- you dont notice the weight leading to unexpected bodyroll when cornering harder

the build quality however feels solid and i love the technology in this car compared to our beloved luxury brands like mercedes
the acceleration is fun and it has good handling.",2025-03-19T11:54:28Z,2,1,,en,youtube,2026-01-14T13:23:11.719116
UgxINrMrKRBWTTzBkOl4AaABAg,yOfvuk_ZgJY,19e9118fd6c4d63d,When did ppl start to know tsla is old tech.  BYD is ten years ahead  of tsla now,2025-03-18T11:41:49Z,0,0,,en,youtube,2026-01-14T13:23:11.719121
UgxfpVaIhXJt1AEPr1p4AaABAg,yOfvuk_ZgJY,19e9118fd6c4d63d,BYD can charge under 10 min. 80 percent  charge,2025-03-18T11:40:39Z,0,0,,en,youtube,2026-01-14T13:23:11.719126
Ugzp4gjfRtqQgPjxJGt4AaABAg,yOfvuk_ZgJY,19e9118fd6c4d63d,Used market  soooo low. Tsla new sales zero next quarter,2025-03-18T11:36:04Z,2,0,,en,youtube,2026-01-14T13:23:11.719136
Ugxjp4bA-WAq6kQPU_p4AaABAg,yOfvuk_ZgJY,19e9118fd6c4d63d,S on carvanna  almost  new under 35 k,2025-03-18T11:35:19Z,0,0,,en,youtube,2026-01-14T13:23:11.719142
Ugwtxmf6ycRYgO9g80p4AaABAg,yOfvuk_ZgJY,7c92580f1c50a4de,"Cut government waste!  Get rid of Elon MUSK!

People calling the Cybertruck a ""clown car"" should be ashamed of themselves, because many clowns have much better taste than this hilarious embarrassment of a mobile trash can. Boycott tesla cyber trucks and cars! Don't buy swasticars either.",2025-03-17T19:56:34Z,3,1,,en,youtube,2026-01-14T13:23:11.719238
UgzuhLqooi4Z1lLl96J4AaABAg,yOfvuk_ZgJY,38d9bba7b8af61a3,Simple. Don’t buy one.,2025-03-14T15:41:42Z,0,0,,en,youtube,2026-01-14T13:23:11.719243
Ugx1ex06XTCwwxkxfP54AaABAg,6nCw50D5TWQ,77ed58c83baec5a2,"You know, it sucks that we have to keep renewing registration each year, you would think that's enough of a rip off to pay for the roads, but no, they tax gas and also charge extra for EVs.",2024-03-22T13:26:22Z,46,7,,en,youtube,2026-01-14T13:23:11.932222
Ugx1ex06XTCwwxkxfP54AaABAg.A1Hs0lUTfWOA5Xfb_uMDj_,6nCw50D5TWQ,b663c2370fc02988,"So all in all, it’s a stupid idea to own an EV car?",2024-07-06T02:51:22Z,5,0,Ugx1ex06XTCwwxkxfP54AaABAg,en,youtube,2026-01-14T13:23:11.932278
Ugx1ex06XTCwwxkxfP54AaABAg.A1Hs0lUTfWOAAxNz0842V9,6nCw50D5TWQ,61cc5a86011a457e,that is what you vote for in your city and state.  in blue states.. deserve all the charges for supporting government social services and open borders.,2024-11-17T18:25:00Z,1,0,Ugx1ex06XTCwwxkxfP54AaABAg,en,youtube,2026-01-14T13:23:11.932322
Ugx1ex06XTCwwxkxfP54AaABAg.A1Hs0lUTfWOAH9Un7usRuG,6nCw50D5TWQ,156160da5f595325,@vincentn2786 No it means we need to change the laws  since everyone is scared of change and want's to ride their horse and buggy yet.,2025-04-20T23:43:02Z,0,0,Ugx1ex06XTCwwxkxfP54AaABAg,en,youtube,2026-01-14T13:23:11.932336
Ugx1ex06XTCwwxkxfP54AaABAg.A1Hs0lUTfWOAM15uHmF4Dk,6nCw50D5TWQ,5d42431c090bff27,"I think they use some of the tax for EVs to offset the same nasty stuff that it costs to manufacturer and produce gas vehicles too.  When you look into the manufacturing of EVs, and what is done with dead battery packs (that cannot be recycled or reused/refurbished), it's not as pretty as you'd think.  Whereas a lot of a gas-powered car can be recycled, melted down and reused (I think I had read somewhere this number can be anywhere from 65% to as much as 85% of a junked car can be recycled).",2025-08-20T00:08:36Z,1,0,Ugx1ex06XTCwwxkxfP54AaABAg,en,youtube,2026-01-14T13:23:11.932349
Ugx1ex06XTCwwxkxfP54AaABAg.A1Hs0lUTfWOAQ53gC_5jYL,6nCw50D5TWQ,0dd5fa2f81eae838,They tax you from birth what did you expect 😂,2025-11-28T23:11:45Z,1,0,Ugx1ex06XTCwwxkxfP54AaABAg,en,youtube,2026-01-14T13:23:11.932356
UgzHjzwjA_ZNGZdTz1F4AaABAg,6nCw50D5TWQ,530e1acab89dead8,Great video and pretty eye opening. I wanted to trade in my paid off Ram and jump to a EV pickup in the future but that seems to be years away for me. It’s crazy how we want to push people to EVs when it’s so expensive to own one.,2024-03-22T17:38:41Z,14,0,,en,youtube,2026-01-14T13:23:11.932362
UgzSyGIhf9QpvQAJPN14AaABAg,6nCw50D5TWQ,51fdd58c4d5b149e,"After watching this, I'm good with my 2016 corolla. She can probably serve me for another 8 years for no issue",2024-09-13T15:31:38Z,47,6,,en,youtube,2026-01-14T13:23:12.328670
UgzSyGIhf9QpvQAJPN14AaABAg.A8KhTOCndwAADVARkMOPzk,6nCw50D5TWQ,cb16597f76b71bce,"I also got a 2016 Corolla. She’s been good to me all these years. Bought it brand new, zero miles.. now’s it has 170k miles..",2025-01-19T23:42:56Z,3,0,UgzSyGIhf9QpvQAJPN14AaABAg,en,youtube,2026-01-14T13:23:11.932376
UgzSyGIhf9QpvQAJPN14AaABAg.A8KhTOCndwAAEFXRAbON8C,6nCw50D5TWQ,6a267a42a2350f46,I got 2017 Prius. Paid 20k and I have 150k miles. Only expense besides one set of tires and oil changes was wheel bearing. Other than that no other issues and I spend $50 a month on gas tops. Teasla is cool but I hate when people say it's saving money. It saves nothing unless you drive a tank to commute. Any reasonable sedan will cost fraction in total cost of the car and maintenance. EVs are cool but that's the only reason to buy one,2025-02-07T18:27:23Z,5,0,UgzSyGIhf9QpvQAJPN14AaABAg,en,youtube,2026-01-14T13:23:11.932382
UgzSyGIhf9QpvQAJPN14AaABAg.A8KhTOCndwAAER2jioeD1d,6nCw50D5TWQ,58072ead6e6be1dd,@jasperekthe insurance cost is the deal breaker. My corolla 2003 is so reliable and super cheap to maintain. i want a tesla because its fast but so expensive in many ways,2025-02-12T05:50:03Z,1,0,UgzSyGIhf9QpvQAJPN14AaABAg,en,youtube,2026-01-14T13:23:11.932388
UgzSyGIhf9QpvQAJPN14AaABAg.A8KhTOCndwAAEwGxQOMmK2,6nCw50D5TWQ,33eb3715e83aa44a,"Effectively, you will end up spending three times more. The only real advantage is being able to show off",2025-02-24T18:09:57Z,1,0,UgzSyGIhf9QpvQAJPN14AaABAg,en,youtube,2026-01-14T13:23:11.932393
UgzSyGIhf9QpvQAJPN14AaABAg.A8KhTOCndwAAEwJ1mL_cCW,6nCw50D5TWQ,6a267a42a2350f46,@jayanmanol I did a quote for a Model Y I was interested in and my insurance would go up 3 times while compareble ice small SUV from the same year would bring the insure up only 200 compared to 1200,2025-02-24T18:28:10Z,0,0,UgzSyGIhf9QpvQAJPN14AaABAg,en,youtube,2026-01-14T13:23:11.932399
UgworjBqgSq65l27BEl4AaABAg,6nCw50D5TWQ,6c6979bec918c7b5,"TLDR:
If you’re buying a Tesla to save money compared to gas vehicles you’re buying the wrong car for the wrong reasons. If you want to save money on gas and maintenance buy a hybrid like a Prius",2025-07-31T14:40:41Z,7,0,,en,youtube,2026-01-14T13:23:12.328458
UgzrouHeijQwpbmh2XV4AaABAg,6nCw50D5TWQ,8b7c44cfc069824b,Great thumbnail. Really caught me interest. 👍,2024-03-22T15:50:06Z,5,0,,en,youtube,2026-01-14T13:23:11.932410
UgxJBAARie6CVlIOCTZ4AaABAg,6nCw50D5TWQ,a0db5fbcb814eb3f,I’m paying 120-140 for 26 gal on my truck every 4 days driving 42 miles a day I’m definitely getting a Tesla now I can charge for free at my place of work,2024-09-07T03:09:58Z,49,4,,en,youtube,2026-01-14T13:23:12.328676
UgxJBAARie6CVlIOCTZ4AaABAg.A83vozGS0QNAF1qYT-aKVT,6nCw50D5TWQ,b870cf45e5897314,"If you don’t need that much range, get a 2025 Lexus rz300e base model. If you lease it, they give you 10K off the price from EV rebates. You get to lease it for a price of 34K and then negotiate the money factor on the lease so the payment goes down. Tell them you can’t pay over $500 a month on it and ask if that’s the best price or else you won’t be able to take it. Then you just buy it once your 3 year lease is done!",2025-02-27T07:25:10Z,3,0,UgxJBAARie6CVlIOCTZ4AaABAg,en,youtube,2026-01-14T13:23:11.932423
UgxJBAARie6CVlIOCTZ4AaABAg.A83vozGS0QNAF1q_Zluf_G,6nCw50D5TWQ,b870cf45e5897314,Not to mention it’s more efficient on electricity than a tesla!,2025-02-27T07:25:27Z,2,0,UgxJBAARie6CVlIOCTZ4AaABAg,en,youtube,2026-01-14T13:23:11.932429
UgxJBAARie6CVlIOCTZ4AaABAg.A83vozGS0QNAKIHJP7qWbF,6nCw50D5TWQ,d46241d7b81b5677,@artificial_commenterdoes this actually work or is it bs?,2025-07-07T23:12:35Z,0,0,UgxJBAARie6CVlIOCTZ4AaABAg,en,youtube,2026-01-14T13:23:11.932439
UgxJBAARie6CVlIOCTZ4AaABAg.A83vozGS0QNANLc_a71mRv,6nCw50D5TWQ,4210dd2a6ca66e6d,"Yes, get out of that truck and into an EV.  I have a longer commute and I need something to offset the gas.",2025-09-21T19:59:05Z,0,0,UgxJBAARie6CVlIOCTZ4AaABAg,en,youtube,2026-01-14T13:23:11.932445
UgyMUreYNHtrpswHADp4AaABAg,6nCw50D5TWQ,77ed58c83baec5a2,"Good thing I live in CA so cold weather is not a problem and at my work, they have free charging 🔋😅",2024-03-22T13:20:33Z,32,2,,en,youtube,2026-01-14T13:23:11.932451
UgyMUreYNHtrpswHADp4AaABAg.A1HrM9dxh58A1I2w6AkMAY,6nCw50D5TWQ,284038396ca42734,Didn't Cali have a time where electrical uses were based on what the government allowed?,2024-03-22T15:10:27Z,1,0,UgyMUreYNHtrpswHADp4AaABAg,en,youtube,2026-01-14T13:23:11.932457
UgyMUreYNHtrpswHADp4AaABAg.A1HrM9dxh58A1I5XoMWZvI,6nCw50D5TWQ,77ed58c83baec5a2,"@DUICE08 As long as you pay for it, you can use as much as you want",2024-03-22T15:33:13Z,0,0,UgyMUreYNHtrpswHADp4AaABAg,en,youtube,2026-01-14T13:23:11.932463
UgydQc-XoAqYuzouVpd4AaABAg,6nCw50D5TWQ,2e2658be5838300d,"Tesla owner here in the Bay Area, California. If you like remote temperature control before you get to the car, getting in the car and drive instantly without warming up the engine, smelling the first whip of the gas exhaust, no oil stain in your driveway, 360 degrees covered dash cam, driving in heavy traffic all the time, teslas may be a good option. But here in the Bay Area we are paying premium for charging both at superchargers and at home unless you have discounts or free charging some where. Owning a Tesla is getting very expensive. And don’t ever trust the advertised range even for a new one. In real world  you’ll get 85-90% of that in normal driving.",2024-11-15T01:00:37Z,16,1,,en,youtube,2026-01-14T13:23:12.328626
UgydQc-XoAqYuzouVpd4AaABAg.AAqMrwreTxwABOzCVoBbQ7,6nCw50D5TWQ,44d5912c9c9c13a7,First mistake was not leaving CA,2024-11-28T20:57:46Z,4,0,UgydQc-XoAqYuzouVpd4AaABAg,en,youtube,2026-01-14T13:23:11.932475
Ugyltj_otP9Q3AYMjSl4AaABAg,6nCw50D5TWQ,bf3c745aa2fd6f2a,I was just trying to find a video like this 👍🏻😊,2024-03-22T19:06:25Z,2,0,,en,youtube,2026-01-14T13:23:11.932481
Ugy2hX68Ua1_gppS_KZ4AaABAg,6nCw50D5TWQ,dd24f1f67da98467,"Tesla offers cutting-edge tech, reduced fuel costs, and a unique driving experience, but hidden costs—like charging setup, insurance, tire wear, and taxes—make it expensive. It’s ideal for tech enthusiasts, but not always the cheapest or most practical option.",2024-11-25T11:23:16Z,4,0,,en,youtube,2026-01-14T13:23:12.328611
Ugwy3ZA7YxXKvYwlp014AaABAg,6nCw50D5TWQ,816beaec72c882b0,"Dude, in winter like that get a proper winter tire. All seasons are horrible below freezing.",2025-12-07T17:35:53Z,0,0,,en,youtube,2026-01-14T13:23:12.328395
UgyDS1kEnzqDCvYtBXZ4AaABAg,6nCw50D5TWQ,a131a9d29dffef58,I did one day of research and it’s so many cheaper options to get charging at home without the huge electric update,2025-05-08T17:08:55Z,0,0,,en,youtube,2026-01-14T13:23:12.328513
UgwiXbZ1rTyHn9k20Ox4AaABAg,6nCw50D5TWQ,c18e3536bf3880a2,I’m in Florida so the only big deterrent is the insurance. Clean record but this state is a mess with any type of insurance.,2024-04-15T16:14:29Z,4,0,,en,youtube,2026-01-14T13:23:12.328815
UgzRy3qH4yfrFYFUr4J4AaABAg,6nCw50D5TWQ,218c42d0efa46d56,"I disagree with many of the things you said in this video. Consumers Energy has a rebate where you can get your EV charger for basically free. Also, charging at night is way cheaper than buying gas. Also, if you have to use the Superchargers on a daily basis, then buying an EV is not for you.",2024-05-17T15:34:27Z,13,1,,en,youtube,2026-01-14T13:23:12.328762
